"Selective High Schools Minimum Entry Scores, 2015","for further information see attachment. Entry into these schools in Year 7 is determined by the students results in the Selective High School Placement Test 1 in English (including reading and writing), mathematics and general ability, together with their primary school's assessment of their performance in English and mathematics. Other evidence of academic merit may also be considered.","CC_30_BY_AUS","['Students']","Public","Yes","published","English","NSW Department of Education","Dataset","[1454974987, 1454974987]","EDUCATION","Active","Annual","info@cese.nsw.gov.au","No","01.01.15","31.12.15","{'type': 'Polygon', 'coordinates': [[[140.999279036, -37.5050765707], [159.105430341, -37.5050765707], [159.105430341, -28.1570205549], [140.999279036, -28.1570205549], [140.999279036, -37.5050765707]]]}","cwt5-xq72","New South Wales","Schools",,"n/a","1301 Education Systems"
"NSW Public School Teachers - Time fraction per week employed","Based on number of teachers employed on the census date (2012) and includes casual teachers. 0.2 = 1 day.  Time fraction greater than 1 is due to teachers taking pay in advance for leave.","CC_30_BY_AUS","['teachers', 'days per week']","Public","Yes","published","English","NSW Department of Education","Dataset","[1409816013, 1409816013]","EDUCATION","Inactive","As required","info@cese.nsw.gov.au","No","01.01.12","31.12.12","{'type': 'Polygon', 'coordinates': [[[140.999279036, -37.5050765707], [159.105430341, -37.5050765707], [159.105430341, -28.1570205549], [140.999279036, -28.1570205549], [140.999279036, -37.5050765707]]]}","autg-7yjp","New South Wales","Teachers",,"n/a","1301 Education Systems"
"NSW Public School Teachers by Gender","Based on number of teachers employed on census date (2012) and includes casual teachers","CC_30_BY_AUS","['teachers', 'gender']","Public","Yes","published","English","NSW Department of Education","Dataset","[1408683485, 1409815692]","EDUCATION","Inactive","As required","info@cese.nsw.gov.au","No","01.01.12","31.12.12","{'type': 'Polygon', 'coordinates': [[[140.999279036, -37.5050765707], [159.105430341, -37.5050765707], [159.105430341, -28.1570205549], [140.999279036, -28.1570205549], [140.999279036, -37.5050765707]]]}","duy7-ihnk","New South Wales","Teachers",,"n/a","1301 Education Systems"
"NSW Public School Teachers - Graduation Year","Based on number of teachers employed on the census date (2012) and includes casual teachers","CC_30_BY_AUS","['teachers', 'graduation']","Public","Yes","published","English","NSW Department of Education","Dataset","[1409816188, 1409816188]","EDUCATION","Inactive","As required","info@cese.nsw.gov.au","No","01.01.12","31.12.12","{'type': 'Polygon', 'coordinates': [[[140.999279036, -37.5050765707], [159.105430341, -37.5050765707], [159.105430341, -28.1570205549], [140.999279036, -28.1570205549], [140.999279036, -37.5050765707]]]}","ez58-4s7f","New South Wales","Teachers",,"n/a","1301 Education Systems"
"Employee Assistance Program, Annual Cost By Financial Year 2011-2015","Refer to attachment for more information. The Employee Assistance Program (EAP) is a service provided by the NSW Department of Education to support the health and wellbeing of its employees.","CC_30_BY_AUS","['teachers', 'health', 'employee assistance']","Public","Yes","published","English","NSW Department of Education","Dataset","[1453186319, 1453186319]","EDUCATION","Inactive","As required","info@cese.nsw.gov.au","No","01.01.11","31.12.15","{'type': 'Polygon', 'coordinates': [[[140.999279036, -37.5050765707], [159.105430341, -37.5050765707], [159.105430341, -28.1570205549], [140.999279036, -28.1570205549], [140.999279036, -37.5050765707]]]}","smeg-derx","New South Wales","Teachers",,"n/a","1301 Education Systems"
"NSW Public School Teachers - Indigenous Status","Based on number of teachers employed on the census date (2012) and includes casual teachers","CC_30_BY_AUS","['teachers', 'indigenous', 'aboriginal', 'tsi']","Public","Yes","published","English","NSW Department of Education","Dataset","[1409546691, 1448321797]","EDUCATION","Inactive","As required","info@cese.nsw.gov.au","No","01.01.12","31.12.12","{'type': 'Polygon', 'coordinates': [[[140.999279036, -37.5050765707], [159.105430341, -37.5050765707], [159.105430341, -28.1570205549], [140.999279036, -28.1570205549], [140.999279036, -37.5050765707]]]}","xcny-pjgv","New South Wales","Teachers",,"n/a","1301 Education Systems"
"NSW Public School Teachers - Type of employment","Based on number of teachers employed on the census date (2012) and includes casual teachers","CC_30_BY_AUS","['teachers', 'permanent', 'casual', 'temporary']","Public","Yes","published","English","NSW Department of Education","Dataset","[1409556197, 1412906816]","EDUCATION","Inactive","As required","info@cese.nsw.gov.au","No","01.01.12","31.12.12","{'type': 'Polygon', 'coordinates': [[[140.999279036, -37.5050765707], [159.105430341, -37.5050765707], [159.105430341, -28.1570205549], [140.999279036, -28.1570205549], [140.999279036, -37.5050765707]]]}","grj2-vrc9","New South Wales","Teachers",,"n/a","1301 Education Systems"
"NSW Public School Teachers - Tertiary Qualification level","Based on number of teachers employed on the census date (2012) and includes casual teachers","CC_30_BY_AUS","['teachers', 'qualifications', 'degrees']","Public","Yes","published","English","NSW Department of Education","Dataset","[1408684704, 1409816105]","EDUCATION","Inactive","As required","info@cese.nsw.gov.au","No","01.01.12","31.12.12","{'type': 'Polygon', 'coordinates': [[[140.999279036, -37.5050765707], [159.105430341, -37.5050765707], [159.105430341, -28.1570205549], [140.999279036, -28.1570205549], [140.999279036, -37.5050765707]]]}","wjcp-dq3c","New South Wales","Teachers",,"n/a","1301 Education Systems"
"NSW Public School Teachers - Tertiary Qualifications (by Type)","Based on number of teachers employed on the census date (2012) and includes casual teachers","CC_30_BY_AUS","['teachers', 'qualifications', 'degrees']","Public","Yes","published","English","NSW Department of Education","Dataset","[1446605694, 1446605694]","EDUCATION","Inactive","As required","info@cese.nsw.gov.au","No","01.01.12","31.12.12","{'type': 'Polygon', 'coordinates': [[[140.999279036, -37.5050765707], [159.105430341, -37.5050765707], [159.105430341, -28.1570205549], [140.999279036, -28.1570205549], [140.999279036, -37.5050765707]]]}","kpnx-9cx2","New South Wales","Teachers",,"n/a","1301 Education Systems"
"Permanent School Teacher Sick Leave Average, 2007-2014","For further information see attachment. Sick leave taken includes full pay, half pay (only available up to 18 February 2009 under the previous Determination), no pay and special concessional sick leave.","CC_30_BY_AUS","['teachers', 'sick leave', 'permanent staff']","Public","Yes","published","English","NSW Department of Education","Dataset","[1454972578, 1454972578]","EDUCATION","Active","As required","info@cese.nsw.gov.au","No","01.01.07","31.12.14","{'type': 'Polygon', 'coordinates': [[[140.999279036, -37.5050765707], [159.105430341, -37.5050765707], [159.105430341, -28.1570205549], [140.999279036, -28.1570205549], [140.999279036, -37.5050765707]]]}","q7xv-pyvr","New South Wales","Teachers",,"n/a","1301 Education Systems"
"Employee Assistance Program, Services Accessed By Year,  2011-2015","Refer to attachment for more information. The Employee Assistance Program (EAP) is a service provided by the NSW Department of Education to support the health and wellbeing of its employees.","CC_30_BY_AUS","['teachers', 'staff', 'assistance health', 'wellbeing']","Public","Yes","published","English","NSW Department of Education","Dataset","[1453186499, 1453186499]","EDUCATION","Active","Annual","info@cese.nsw.gov.au","No","01.01.11","31.12.15","{'type': 'Polygon', 'coordinates': [[[140.999279036, -37.5050765707], [159.105430341, -37.5050765707], [159.105430341, -28.1570205549], [140.999279036, -28.1570205549], [140.999279036, -37.5050765707]]]}","krjq-3jfr","New South Wales","Teachers",,"n/a","1301 Education Systems"
"Retirement Rates For Permanent NSW Government School Teachers, 2006-2014","The retirement rates for NSW government school teachers remains relatively low. The rate has remained around 4 per cent as the 'baby boomers' reach retirement age. data from the Workforce Profile Update 2014.","CC_30_BY_AUS","['teachers', 'teaching profession', 'teacher data', 'primary', 'secondary', 'baby boomers', 'medical retirement']","Public","Yes","published","English","NSW Department of Education","Dataset","[1466481911, 1466481911]","EDUCATION","Active","As required","info@cese.nsw.gov.au","No","01.01.06","31.12.14","{'type': 'Polygon', 'coordinates': [[[140.999279036, -37.5050765707], [159.105430341, -37.5050765707], [159.105430341, -28.1570205549], [140.999279036, -28.1570205549], [140.999279036, -37.5050765707]]]}","3ss8-wn4j","New South Wales","Teachers",,"n/a","1301 Education Systems"
"NSW Public School Teachers - Years employed by NSW DEC","Based on number of teachers employed on census date (2012) and includes casual teachers","CC_30_BY_AUS","['teachers', 'years employed']","Public","Yes","published","English","NSW Department of Education","Dataset","[1409815424, 1409815723]","EDUCATION","Inactive","As required","info@cese.nsw.gov.au","No","01.01.12","31.12.12","{'type': 'Polygon', 'coordinates': [[[140.999279036, -37.5050765707], [159.105430341, -37.5050765707], [159.105430341, -28.1570205549], [140.999279036, -28.1570205549], [140.999279036, -37.5050765707]]]}","g5kn-6imz","New South Wales","Teachers",,"n/a","1301 Education Systems"
"NSW Public School Teachers - Salary range","Based on number of teachers employed on census date (2012) and includes casual teachers","CC_30_BY_AUS","['Teachers']","Public","Yes","published","English","NSW Department of Education","Dataset","[1409557130, 1409815890]","EDUCATION","Inactive","As required","info@cese.nsw.gov.au","No","01.01.12","31.12.12","{'type': 'Polygon', 'coordinates': [[[140.999279036, -37.5050765707], [159.105430341, -37.5050765707], [159.105430341, -28.1570205549], [140.999279036, -28.1570205549], [140.999279036, -37.5050765707]]]}","ug7u-7p9r","New South Wales","Teachers",,"n/a","1301 Education Systems"
"NSW Public School Teachers - School Type by Gender","Based on number of teachers employed on census date (2012) and includes casual teachers","CC_30_BY_AUS","['Teachers']","Public","Yes","published","English","NSW Department of Education","Dataset","[1409614872, 1409815823]","EDUCATION","Inactive","As required","info@cese.nsw.gov.au","No","01.01.12","31.12.12","{'type': 'Polygon', 'coordinates': [[[140.999279036, -37.5050765707], [159.105430341, -37.5050765707], [159.105430341, -28.1570205549], [140.999279036, -28.1570205549], [140.999279036, -37.5050765707]]]}","xcjp-967z","New South Wales","Teachers",,"n/a","1301 Education Systems"
"Completed Apprenticeships And Traineeships in NSW, 1997-2010","For more information refer to attachment. There has been an increase of 251 per cent in the number of people completing a traineeship or apprenticeship between 1997 and 2010.","CC_30_BY_AUS","['trainee', 'apprentice', 'traineeship', 'apprenticeship']","Public","Yes","published","English","NSW Department of Education","Dataset","[1453183883, 1453183883]","EDUCATION","Inactive","As required","info@cese.nsw.gov.au","No","01.01.97","31.12.10","{'type': 'Polygon', 'coordinates': [[[140.999279036, -37.5050765707], [159.105430341, -37.5050765707], [159.105430341, -28.1570205549], [140.999279036, -28.1570205549], [140.999279036, -37.5050765707]]]}","5a98-94wv","New South Wales","Vocational Education & Training (VET)",,"n/a","1301 Education Systems"
"Completion Rates For Apprenticeships Commencing In 2009 And 2010","Percentage of apprenticeships completed, in 2009 and 2010. Sorted by industry.","CC_30_BY_AUS","['vet', 'apprentice', 'training', 'industry']","Public","Yes","published","English","NSW Department of Education","Dataset","[1455594037, 1455594037]","EDUCATION","Inactive","As required","info@cese.nsw.gov.au","No","01.01.09","31.12.10","{'type': 'Polygon', 'coordinates': [[[140.999279036, -37.5050765707], [159.105430341, -37.5050765707], [159.105430341, -28.1570205549], [140.999279036, -28.1570205549], [140.999279036, -37.5050765707]]]}","qjhp-wep4","New South Wales","Vocational Education & Training (VET)",,"n/a","1301 Education Systems"
"Number of VET Students, 2010-2014","Number of students studying VET courses, all ages, and total for the five year period","CC_30_BY_AUS","['vet', 'students']","Public","Yes","published","English","NSW Department of Education","Dataset","[1455592750, 1455592750]","EDUCATION","Inactive","As required","info@cese.nsw.gov.au","No","01.01.10","31.12.14","{'type': 'Polygon', 'coordinates': [[[140.999279036, -37.5050765707], [159.105430341, -37.5050765707], [159.105430341, -28.1570205549], [140.999279036, -28.1570205549], [140.999279036, -37.5050765707]]]}","hp5u-96jq","New South Wales","Vocational Education & Training (VET)",,"n/a","1301 Education Systems"
"Number Of Students In Years 11 And 12 Enrolled In One Or More VET Courses","Source: NSW Board of Studies data as at July each year.","CC_30_BY_AUS","['vet', 'study patterns', 'students']","Public","Yes","published","English","NSW Department of Education","Dataset","[1397184285, 1429129108]","EDUCATION","Inactive","As required","info@cese.nsw.gov.au","No","01.01.14","31.12.14","{'type': 'Polygon', 'coordinates': [[[140.999279036, -37.5050765707], [159.105430341, -37.5050765707], [159.105430341, -28.1570205549], [140.999279036, -28.1570205549], [140.999279036, -37.5050765707]]]}","r2h9-s8iy","New South Wales","Vocational Education & Training (VET)",,"n/a","1301 Education Systems"
"Median weekly cost of centre-based long day care, NSW and other jurisdictions ($/week), 2013","* Source: SCRGSP  2014, Report on Government Services 2014, vol. B Childcare, education and training, Productivity Commission, Canberra, Table 3A.30 
* 2012/13 dollars","CC_30_BY_AUS","['weekly cost', 'long day care']","Public","Yes","published","English","NSW Department of Education","Dataset","[1409843947, 1409843947]","EDUCATION","Inactive","As required","info@cese.nsw.gov.au","No","01.01.13","31.12.13","{'type': 'Polygon', 'coordinates': [[[140.999279036, -37.5050765707], [159.105430341, -37.5050765707], [159.105430341, -28.1570205549], [140.999279036, -28.1570205549], [140.999279036, -37.5050765707]]]}","f6jz-uc7f","New South Wales","Early childhood",,"n/a","1301 Education Systems"
