"Resource Allocation Model and Family Occupation Educational Index, 2016","The Resource Allocation Model (RAM) has been developed to ensure a fair, efficient and transparent allocation of the education budget for every school.
The model, introduced in phases, recognises that students and school communities are not all the same  they have different needs and require different levels of support.","CC_30_BY_AUS","['ram', 'resource allocation model', 'foei', 'family occupation education index', 'funding', 'budget']","Public","Yes","published","English","NSW Department of Education","Dataset","[1449727483, 1449727483]","EDUCATION","Inactive","As required","info@cese.nsw.gov.au","No","01.01.16","31.12.16","{'type': 'Polygon', 'coordinates': [[[140.999279036, -37.5050765707], [159.105430341, -37.5050765707], [159.105430341, -28.1570205549], [140.999279036, -28.1570205549], [140.999279036, -37.5050765707]]]}","36g6-5fum","New South Wales","Schools",,"n/a","1301 Education Systems"
"Resignation Rates For Permanent NSW Government Teachers, First Year Of Teaching, 2006 - 2014","Percentage of teachers resigning from teaching in their first year is low, with a small increase from 1.5 per cent to 1.9 per cent from 2013 to 2014. Data from the Workforce Profile Update 2014.","CC_30_BY_AUS","['resignation', 'permanent', 'teachers', 'school staff', 'graduate teachers', 'first year teachers']","Public","Yes","published","English","NSW Department of Education","Dataset","[1466481502, 1466481502]","EDUCATION","Active","As required","info@cese.nsw.gov.au","No","01.01.06","31.12.14","{'type': 'Polygon', 'coordinates': [[[140.999279036, -37.5050765707], [159.105430341, -37.5050765707], [159.105430341, -28.1570205549], [140.999279036, -28.1570205549], [140.999279036, -37.5050765707]]]}","9cmc-dyat","New South Wales","Teachers",,"n/a","1301 Education Systems"
"Resignation Rates For Permanent NSW Government School Teachers, Primary And Secondary, 2006 - 2014","Resignation rates for NSW government school teachers have been in decline since 2006. Data from the Workforce Profile Update 2014.","CC_30_BY_AUS","['resignation', 'permanent', 'teachers', 'school staff', 'primary', 'secondary']","Public","Yes","published","English","NSW Department of Education","Dataset","[1466480716, 1466480716]","EDUCATION","Active","As required","info@cese.nsw.gov.au","No","01.01.06","31.12.14","{'type': 'Polygon', 'coordinates': [[[140.999279036, -37.5050765707], [159.105430341, -37.5050765707], [159.105430341, -28.1570205549], [140.999279036, -28.1570205549], [140.999279036, -37.5050765707]]]}","vnn2-j83h","New South Wales","Teachers",,"n/a","1301 Education Systems"
"Teacher Separations, 2006-2014","Refer to attachment for further information. Separations are resignations, retirements (including medical retirements), terminations and deaths. The separation rates of public school teachers in NSW are low. They have varied between 3.6 per cent and 5 per cent since 2006.","CC_30_BY_AUS","['resignations', 'retirements', 'deaths', 'permanent staff', 'school staff', 'teachers']","Public","Yes","published","English","NSW Department of Education","Dataset","[1454978761, 1454978761]","EDUCATION","Inactive","As required","info@cese.nsw.gov.au","No","01.01.06","31.12.14","{'type': 'Polygon', 'coordinates': [[[140.999279036, -37.5050765707], [159.105430341, -37.5050765707], [159.105430341, -28.1570205549], [140.999279036, -28.1570205549], [140.999279036, -37.5050765707]]]}","q27r-67dg","New South Wales","Teachers",,"n/a","1301 Education Systems"
"Apparent Retention in NSW Government Schools, 2001-2012","All enrolments are reported in full-time equivalent units (FTEs), and include full-time and part-time students. Students enrolled in distance education classes are included with their appropriate grade levels._x000D_
_x000D_
With the New School Leaving Age legislation coming into effect in January 2010, the Year 12 cohort in 2012 is the first group of students who were required to complete Year 10. This means that the Year 10 enrolment figure was higher than in previous years, resulting in a relative decline in Year 10 to Year 12 apparent retention in 2012, despite the Year 7 to Year 12 apparent retention rate increasing slightly.","CC_30_BY_AUS","['retention', 'nsw', 'government schools', '2001-2012']","Public","Yes","published","English","NSW Department of Education","Dataset","[1443593914, 1438584470]","EDUCATION","Active","Annual","info@cese.nsw.gov.au","No","01.01.01","31.12.12","{'type': 'Polygon', 'coordinates': [[[140.999279036, -37.5050765707], [159.105430341, -37.5050765707], [159.105430341, -28.1570205549], [140.999279036, -28.1570205549], [140.999279036, -37.5050765707]]]}","2saw-snjv","New South Wales","Attendance & Retention",,"n/a","1301 Education Systems"
"Apparent Retention in NSW Government Schools, 2001-2014","All enrolments are reported in full-time equivalent units (FTEs), and include full-time and part-time students. Students enrolled in distance education classes are included with their appropriate grade levels.","CC_30_BY_AUS","['retention', 'nsw', 'government schools', '2001-2014']","Public","Yes","published","English","NSW Department of Education","Dataset","[1443593914, 1443593978]","EDUCATION","Active","Annual","info@cese.nsw.gov.au","No","01.01.01","31.12.14","{'type': 'Polygon', 'coordinates': [[[140.999279036, -37.5050765707], [159.105430341, -37.5050765707], [159.105430341, -28.1570205549], [140.999279036, -28.1570205549], [140.999279036, -37.5050765707]]]}","nvn3-uimy","New South Wales","Attendance & Retention",,"n/a","1301 Education Systems"
"NSW Government Schools By FOEI Bands And SA4 Groupings, 2014","All NSW government schools (excluding exceptions as listed) by Family Occupation and Education Index (FOEI), mid-year 2014","CC_30_BY_AUS","['sa4', 'foei', 'family occupation and education index', '2014']","Public","Yes","published","English","NSW Department of Education","Dataset","[1443657502, 1443657502]","EDUCATION","Active","Annual","info@cese.nsw.gov.au","No","01.01.14","31.12.14","{'type': 'Polygon', 'coordinates': [[[140.999279036, -37.5050765707], [159.105430341, -37.5050765707], [159.105430341, -28.1570205549], [140.999279036, -28.1570205549], [140.999279036, -37.5050765707]]]}","5tke-atkd","New South Wales","Schools",,"n/a","1301 Education Systems"
"Sale And Acquisition Of Land, 2000-2014","For more information refer to attachment. The Department has care, control or ownership of about 377 hectares of vacant land across NSW. The Department regularly buys or sells property to meet the demand for public education and maintains its built assets respectively.","CC_30_BY_AUS","['sale', 'acquisition', 'government owned', 'property', 'physical assets']","Public","Yes","published","English","NSW Department of Education","Dataset","[1454973213, 1454973213]","EDUCATION","Active","Annual","info@cese.nsw.gov.au","No","01.01.00","31.12.14","{'type': 'Polygon', 'coordinates': [[[140.999279036, -37.5050765707], [159.105430341, -37.5050765707], [159.105430341, -28.1570205549], [140.999279036, -28.1570205549], [140.999279036, -37.5050765707]]]}","5sgz-wrur","New South Wales","Assets",,"n/a","1301 Education Systems"
"Funds Accumulated From Hiring Of School Facilities, 2014","Refer to attachment for more information. The NSW Department of Education encourages local communities to use school buildings, grounds, playing fields and facilities for appropriate purposes. Opening school facilities to the community is a way of sharing resources and strengthening the partnerships between schools and local communities.","CC_30_BY_AUS","['school assets', 'schools funds', 'hire', 'school facilities']","Public","Yes","published","English","NSW Department of Education","Dataset","[1453426615, 1453426615]","EDUCATION","Active","Annual","info@cese.nsw.gov.au","No","01.01.14","31.12.14","{'type': 'Polygon', 'coordinates': [[[140.999279036, -37.5050765707], [159.105430341, -37.5050765707], [159.105430341, -28.1570205549], [140.999279036, -28.1570205549], [140.999279036, -37.5050765707]]]}","nksd-ctpb","New South Wales","Assets",,"n/a","1301 Education Systems"
"School Certificate Completions in NSW Public Schools, 2005-2011","Refer to attachment for further information. The School Certificate is awarded by the Board of Studies NSW to eligible students at the end of Year 10. The School Certificate Record of Achievement shows all Stage 5 (Years 9 and 10) courses and School Certificate courses completed. It also contains a statement as to whether the student is eligible for the School Certificate.","CC_30_BY_AUS","['school certificate', 'year ten', 'school leavers']","Public","Yes","published","English","NSW Department of Education","Dataset","[1454973633, 1454973633]","EDUCATION","Inactive","As required","info@cese.nsw.gov.au","No","01.01.05","31.12.11","{'type': 'Polygon', 'coordinates': [[[140.999279036, -37.5050765707], [159.105430341, -37.5050765707], [159.105430341, -28.1570205549], [140.999279036, -28.1570205549], [140.999279036, -37.5050765707]]]}","qz5m-8ujg","New South Wales","Higher Education",,"n/a","1301 Education Systems"
"NSW Public School Voluntary School Contributions, 2014","Refer to attachment for more information. Principals can request voluntary general contributions to enhance their school education programs. It is a decision for parents to make payments.","CC_30_BY_AUS","['school contributions', 'voluntary payments']","Public","Yes","published","English","NSW Department of Education","Dataset","[1453433309, 1453433309]","EDUCATION","Inactive","As required","info@cese.nsw.gov.au","No","01.01.14","31.12.14","{'type': 'Polygon', 'coordinates': [[[140.999279036, -37.5050765707], [159.105430341, -37.5050765707], [159.105430341, -28.1570205549], [140.999279036, -28.1570205549], [140.999279036, -37.5050765707]]]}","vfaz-5nn3","New South Wales","Assets",,"n/a","1301 Education Systems"
"Enrolments In Support Classes And Schools For Specific Purposes ( SSPs) By Category, 2014","Enrolments In Support Classes And Schools For Specific Purposes ( SSPs) By Category, 2014","CC_30_BY_AUS","['school for specific purpose', 'enrolments', '2014', 'disability']","Public","Yes","published","English","NSW Department of Education","Dataset","[1443667116, 1443667116]","EDUCATION","Active","Annual","info@cese.nsw.gov.au","No","01.01.14","31.12.14","{'type': 'Polygon', 'coordinates': [[[140.999279036, -37.5050765707], [159.105430341, -37.5050765707], [159.105430341, -28.1570205549], [140.999279036, -28.1570205549], [140.999279036, -37.5050765707]]]}","gwhi-j323","New South Wales","Students",,"n/a","1301 Education Systems"
"NSW government schools by type and ABS statistical area, mid-year 2013"," Lucas Heights Community School, Hunter School of Performing Arts, Southern Cross School, Wadalba Community School, Alexandria Park Community School and Evans River Community School are included with central/community schools","CC_30_BY_AUS","['school type', 'abs statistical area']","Public","Yes","published","English","NSW Department of Education","Dataset","[1413338471, 1413338471]","EDUCATION","Inactive","As required","info@cese.nsw.gov.au","No","01.01.13","31.12.13","{'type': 'Polygon', 'coordinates': [[[140.999279036, -37.5050765707], [159.105430341, -37.5050765707], [159.105430341, -28.1570205549], [140.999279036, -28.1570205549], [140.999279036, -37.5050765707]]]}","vjwq-xmta","New South Wales","Schools",,"n/a","1301 Education Systems"
"NSW Government Schools By Type And SA4 Groupings, 2014","As at midyear 2014 - using SA4 groupings as described in notes column.","CC_30_BY_AUS","['school type', 'sa4', '2014']","Public","Yes","published","English","NSW Department of Education","Dataset","[1443655990, 1443655990]","EDUCATION","Active","As required","info@cese.nsw.gov.au","No","01.01.14","31.12.14","{'type': 'Polygon', 'coordinates': [[[140.999279036, -37.5050765707], [159.105430341, -37.5050765707], [159.105430341, -28.1570205549], [140.999279036, -28.1570205549], [140.999279036, -37.5050765707]]]}","jv5x-jutm","New South Wales","Schools",,"n/a","1301 Education Systems"
"NSW Government Schools - Summarised by School Type - 2001-2012","NSW Government Schools - Summarised by School Type - 2001-2012","CC_30_BY_AUS","['school type']","Public","Yes","published","English","NSW Department of Education","Dataset","[1443599451, 1438584553]","EDUCATION","Active","Annual","info@cese.nsw.gov.au","No","01.01.01","31.12.12","{'type': 'Polygon', 'coordinates': [[[140.999279036, -37.5050765707], [159.105430341, -37.5050765707], [159.105430341, -28.1570205549], [140.999279036, -28.1570205549], [140.999279036, -37.5050765707]]]}","45rt-62sr","New South Wales","Schools",,"n/a","1301 Education Systems"
"NSW Public School Funds Available as at December, 2013 & 2014","For more information refer to attachment. Most NSW public schools operate and maintain their own bank accounts. Principals have the flexibility to manage day to day school operations. Schools are accountable to the Department of Education and to the school community for how funds are spent to deliver educational programs.","CC_30_BY_AUS","['schools funds', 'bank accounts', 'financials', 'funding']","Public","Yes","published","English","NSW Department of Education","Dataset","[1453432876, 1453432876]","EDUCATION","Active","Annual","info@cese.nsw.gov.au","No","01.01.13","31.12.14","{'type': 'Polygon', 'coordinates': [[[140.999279036, -37.5050765707], [159.105430341, -37.5050765707], [159.105430341, -28.1570205549], [140.999279036, -28.1570205549], [140.999279036, -37.5050765707]]]}","fyep-2nmw","New South Wales","Assets",,"n/a","1301 Education Systems"
"NSW Public Schools Master Data Set","Comprehensive information for NSW public schools, including location information, school type and contact details. See attachment in about section for lat/longs","CC_30_BY_AUS","['schools', 'geolocation']","Public","Yes","published","English","NSW Department of Education","Dataset","[1463459670, 1463459670]","EDUCATION","Active","As required","info@cese.nsw.gov.au","No","01.01.15","31.12.16","{'type': 'Polygon', 'coordinates': [[[140.999279036, -37.5050765707], [159.105430341, -37.5050765707], [159.105430341, -28.1570205549], [140.999279036, -28.1570205549], [140.999279036, -37.5050765707]]]}","egm2-9jpa","New South Wales","Schools",,"n/a","1301 Education Systems"
"Schools using the DEC-provided Schools Website Service","as at August 2014.  Includes links to calendars.  Replace the dd-mm-yyy with the relevant dates","CC_30_BY_AUS","['schools', 'websites']","Public","Yes","published","English","NSW Department of Education","Dataset","[1413346441, 1413346441]","EDUCATION","Active","As required","info@cese.nsw.gov.au","No","01.01.14","31.12.14","{'type': 'Polygon', 'coordinates': [[[140.999279036, -37.5050765707], [159.105430341, -37.5050765707], [159.105430341, -28.1570205549], [140.999279036, -28.1570205549], [140.999279036, -37.5050765707]]]}","gmp7-3vvd","New South Wales","Schools",,"n/a","1301 Education Systems"
"NSW Government Schools By Classification 2001-2013","The classifications used in the table are not based on the 2013 actual enrolments collected through the mid-year census. The classifications are based on the staffing entitlement classifications reviewed periodically by the Classification Review Committee.","CC_30_BY_AUS","['Schools']","Public","Yes","published","English","NSW Department of Education","Dataset","[1443599497, 1464134267]","EDUCATION","Active","As required","info@cese.nsw.gov.au","No","01.01.01","31.12.13","{'type': 'Polygon', 'coordinates': [[[140.999279036, -37.5050765707], [159.105430341, -37.5050765707], [159.105430341, -28.1570205549], [140.999279036, -28.1570205549], [140.999279036, -37.5050765707]]]}","uvd4-dqsr","New South Wales","Schools",,"n/a","1301 Education Systems"
"Special Education Schools By Category, 2013","Refer to attached for further information. In 2013 more than 90,000 students with a disability and/or additional learning and support needs are enrolled in NSW public schools. Students with confirmed disability can enrol in regular classes with support, and in support classes in regular and special schools.","CC_30_BY_AUS","['Schools']","Public","Yes","published","English","NSW Department of Education","Dataset","[1454975240, 1454975240]","EDUCATION","Inactive","As required","info@cese.nsw.gov.au","No","01.01.13","31.12.13","{'type': 'Polygon', 'coordinates': [[[140.999279036, -37.5050765707], [159.105430341, -37.5050765707], [159.105430341, -28.1570205549], [140.999279036, -28.1570205549], [140.999279036, -37.5050765707]]]}","7dek-8gx3","New South Wales","Schools",,"n/a","1301 Education Systems"
"Secondary Education Schools By Selective, Specialist and Coeducational, 2014","Midyear 2014_x000D_
_x000D_
Secondary Education Schools By Selective, Specialist And Coeducational Status_x000D_
_x000D_
Includes secondary schools and central/community schools. The Conservatorium High School is included with performing arts schools.","CC_30_BY_AUS","['selective', 'specialist', 'coeducational', 'secondary']","Public","Yes","published","English","NSW Department of Education","Dataset","[1443660690, 1443660690]","EDUCATION","Active","Annual","info@cese.nsw.gov.au","No","01.01.14","31.12.14","{'type': 'Polygon', 'coordinates': [[[140.999279036, -37.5050765707], [159.105430341, -37.5050765707], [159.105430341, -28.1570205549], [140.999279036, -28.1570205549], [140.999279036, -37.5050765707]]]}","dviz-dq9d","New South Wales","Schools",,"n/a","1301 Education Systems"
"Places In NSW Specialist Schools Supporting Behaviour, 2001-2013","For more information refer to attachment. The NSW Department of Education has a wide range of support services for students with disruptive or challenging behaviour. These services aim to positively engage students with school and learning.","CC_30_BY_AUS","['ssps', 'specialist schools', 'schools for specific purpose', 'disruptive behaviour', 'support', 'students']","Public","Yes","published","English","NSW Department of Education","Dataset","[1454972919, 1454972919]","EDUCATION","Inactive","As required","info@cese.nsw.gov.au","No","01.01.01","31.12.13","{'type': 'Polygon', 'coordinates': [[[140.999279036, -37.5050765707], [159.105430341, -37.5050765707], [159.105430341, -28.1570205549], [140.999279036, -28.1570205549], [140.999279036, -37.5050765707]]]}","jh3m-hgqh","New South Wales","Schools",,"n/a","1301 Education Systems"
"2011 Statistical Bulletin: Schools and students in NSW","2011 Statistical Bulletin: Schools and students in NSW","CC_30_BY_AUS","['statistical bulletin', 'schools', 'students', '2011', 'aboriginal', 'indigenous']","Public","Yes","published","English","NSW Department of Education","Dataset","[1397448915, 1448321751]","EDUCATION","Inactive","As required","info@cese.nsw.gov.au","No","01.01.11","31.12.11","{'type': 'Polygon', 'coordinates': [[[140.999279036, -37.5050765707], [159.105430341, -37.5050765707], [159.105430341, -28.1570205549], [140.999279036, -28.1570205549], [140.999279036, -37.5050765707]]]}","mtx2-emcg","New South Wales","Statistics Bulletins",,"n/a","1309 Education Systems"
"2013 Statistical Bulletin: Schools and Students in NSW","The Statistical Bulletin is an annual publication which presents a snapshot of NSW schools, preschools and students, including the Aboriginal status and language background of students. The bulletin also includes trend data on enrolments in NSW Government and non-government schools from 1961 to the present day.","CC_30_BY_AUS","['statistics bulletin', 'pdf', 'cese', '2013', 'aboriginal', 'indigenous']","Public","Yes","published","English","NSW Department of Education","Dataset","[1412906462, 1448321499]","EDUCATION","Inactive","As required","info@cese.nsw.gov.au","No","01.01.13","31.12.13","{'type': 'Polygon', 'coordinates': [[[140.999279036, -37.5050765707], [159.105430341, -37.5050765707], [159.105430341, -28.1570205549], [140.999279036, -28.1570205549], [140.999279036, -37.5050765707]]]}","vewm-qzf6","New South Wales","Statistics Bulletins",,"n/a","1302 Education Systems"
"2012 Statistical Bulletin: Schools and students in NSW","2012 Statistical Bulletin: Schools and students in NSW","CC_30_BY_AUS","['statistics bulletin', 'schools', 'students', 'cese', '2012', 'aboriginal', 'indigenous']","Public","Yes","published","English","NSW Department of Education","Dataset","[1397446464, 1448321671]","EDUCATION","Inactive","As required","info@cese.nsw.gov.au","No","01.01.12","31.12.12","{'type': 'Polygon', 'coordinates': [[[140.999279036, -37.5050765707], [159.105430341, -37.5050765707], [159.105430341, -28.1570205549], [140.999279036, -28.1570205549], [140.999279036, -37.5050765707]]]}","nfc3-4gv3","New South Wales","Statistics Bulletins",,"n/a","1307 Education Systems"
"NSW Stats At A Glance, 2015","Overview of NSW education statistics, gathered in 2014.","CC_30_BY_AUS","['statistics', 'education', 'summary', '2014', 'aboriginal', 'indigenous']","Public","Yes","published","English","NSW Department of Education","Dataset","[1445298634, 1448321813]","EDUCATION","Inactive","As required","info@cese.nsw.gov.au","No","01.01.15","31.12.15","{'type': 'Polygon', 'coordinates': [[[140.999279036, -37.5050765707], [159.105430341, -37.5050765707], [159.105430341, -28.1570205549], [140.999279036, -28.1570205549], [140.999279036, -37.5050765707]]]}","tbmz-deni","New South Wales","Statistics Bulletins",,"n/a","1305 Education Systems"
"CESE Bulletin 14 - Schools: Language Diversity in NSW, 2015","This bulletin summarises the diversity of students with a language background other than English (LBOTE) who are enrolled in NSW government schools in 2015.","CC_30_BY_AUS","['statistics', 'education', 'summary', '2014', 'lbote', 'language', 'multicultural']","Public","Yes","published","English","NSW Department of Education","Dataset","[1455586553, 1455586653]","EDUCATION","Inactive","As required","info@cese.nsw.gov.au","No","01.01.15","31.12.15","{'type': 'Polygon', 'coordinates': [[[140.999279036, -37.5050765707], [159.105430341, -37.5050765707], [159.105430341, -28.1570205549], [140.999279036, -28.1570205549], [140.999279036, -37.5050765707]]]}","f5uj-9euy","New South Wales","Statistics Bulletins",,"n/a","1313 Education Systems"
"Schools By Student Attendance And Type, Semester 1 2014","Student attendance rates for primary, central/community and secondary students in NSW.","CC_30_BY_AUS","['students', 'attendance', 'nsw students', 'primary', 'secondary', 'central', 'community']","Public","Yes","published","English","NSW Department of Education","Dataset","[1439360919, 1439360919]","EDUCATION","Active","Annual","info@cese.nsw.gov.au","No","01.01.14","31.12.14","{'type': 'Polygon', 'coordinates': [[[140.999279036, -37.5050765707], [159.105430341, -37.5050765707], [159.105430341, -28.1570205549], [140.999279036, -28.1570205549], [140.999279036, -37.5050765707]]]}","y3f2-rtv8","New South Wales","Attendance & Retention",,"n/a","1301 Education Systems"
"Student Attendance Rate By School Level, 2006-2014","Student attendance data for primary and secondary students in NSW.","CC_30_BY_AUS","['students', 'attendance', 'nsw students', 'primary', 'secondary']","Public","Yes","published","English","NSW Department of Education","Dataset","[1439361027, 1439361027]","EDUCATION","Active","Annual","info@cese.nsw.gov.au","No","01.01.06","31.12.14","{'type': 'Polygon', 'coordinates': [[[140.999279036, -37.5050765707], [159.105430341, -37.5050765707], [159.105430341, -28.1570205549], [140.999279036, -28.1570205549], [140.999279036, -37.5050765707]]]}","kdmv-4gjw","New South Wales","Attendance & Retention",,"n/a","1301 Education Systems"
"Aboriginal Student Attendance Rate By School Level, 2006-2014","Aboriginal student attendance data for primary and secondary students in NSW.","CC_30_BY_AUS","['students', 'attendance', 'primary', 'secondary', 'aboriginal', 'indigenous']","Public","Yes","published","English","NSW Department of Education","Dataset","[1448319261, 1448319261]","EDUCATION","Active","Annual","info@cese.nsw.gov.au","No","01.01.06","31.12.14","{'type': 'Polygon', 'coordinates': [[[140.999279036, -37.5050765707], [159.105430341, -37.5050765707], [159.105430341, -28.1570205549], [140.999279036, -28.1570205549], [140.999279036, -37.5050765707]]]}","fxte-i6n5","New South Wales","Attendance & Retention",,"n/a","1301 Education Systems"
"Completion Rates For Traineeships Commencing In 2009 And 2010","Percentage of traineeships that were completed, sorted by industry.","CC_30_BY_AUS","['students', 'vocational educations', 'trainees']","Public","Yes","published","English","NSW Department of Education","Dataset","[1455593845, 1455593845]","EDUCATION","Inactive","As required","info@cese.nsw.gov.au","No","01.01.09","31.12.10","{'type': 'Polygon', 'coordinates': [[[140.999279036, -37.5050765707], [159.105430341, -37.5050765707], [159.105430341, -28.1570205549], [140.999279036, -28.1570205549], [140.999279036, -37.5050765707]]]}","4iqi-7djh","New South Wales","Vocational Education & Training (VET)",,"n/a","1301 Education Systems"
