"Title","Description","License","Tags","Groups","Visibility","Format","Language","Publisher","Type","[DateAdded, Date Modified]","Theme","Data Status","Update Frequency","Contact email","Expose User Contact Information","Temporal coverage from","Temporal coverage to","Geospatial coverage","Socrata ID","Jurisdiction","Category","Geospatial Topic","Data Models","Field of Research"
"Enrolments ( FTE) Of Aboriginal Students By SA4 Groupings And Grade Groups, 2014","Enrolments (FTE) of Aboriginal students by SA4 groupings and grade groups in NSW government schools, mid-year 2014","CC_30_BY_AUS","['aboriginal students', 'sa4', 'enrolment', '2014', 'indigenous']","Public","Yes","published","English","NSW Department of Education","Dataset","[1448319497, 1448319498]","EDUCATION","Active","Annual","info@cese.nsw.gov.au","No","01.01.14","31.12.14","{'type': 'Polygon', 'coordinates': [[[140.999279036, -37.5050765707], [159.105430341, -37.5050765707], [159.105430341, -28.1570205549], [140.999279036, -28.1570205549], [140.999279036, -37.5050765707]]]}","tmt8-fi3a","New South Wales","Students",,"n/a","1301 Education Systems"
"Administrative Cost of Education Per Child In Australian Public Schools, 2012-13","Refer to attachment for more information. NSW has the largest public school system in Australia, with spending of $15,405 per public school student in 2012/13*.","CC_30_BY_AUS","['administrative costs', 'administration', 'education costs', 'financial']","Public","Yes","published","English","NSW Department of Education","Dataset","[1453184328, 1453184328]","EDUCATION","Inactive","As required","info@cese.nsw.gov.au","No","01.01.12","31.12.13","{'type': 'Polygon', 'coordinates': [[[140.999279036, -37.5050765707], [159.105430341, -37.5050765707], [159.105430341, -28.1570205549], [140.999279036, -28.1570205549], [140.999279036, -37.5050765707]]]}","ctya-sie3","New South Wales","Assets",,"n/a","1301 Education Systems"
"Age Distribution Of Students In Preschools & Early Intervention Programs, 2014","Age distribution of students in nsw government preschools and early intervention programs, mid-year 2014","CC_30_BY_AUS","['age distribution', 'preschools', 'early intervention', '2014']","Public","Yes","published","English","NSW Department of Education","Dataset","[1443667453, 1443667453]","EDUCATION","Active","Annual","info@cese.nsw.gov.au","No","01.01.14","31.12.14","{'type': 'Polygon', 'coordinates': [[[140.999279036, -37.5050765707], [159.105430341, -37.5050765707], [159.105430341, -28.1570205549], [140.999279036, -28.1570205549], [140.999279036, -37.5050765707]]]}","naxc-4nmz","New South Wales","Students",,"n/a","1301 Education Systems"
"Age-grade Distribution Of Students In Schools, 2014 ( SSP) By Age And Category","Age-grade distribution of students in nsw government schools, mid-year 2014 students in schools for specific purposes by age and category","CC_30_BY_AUS","['age grade distribution', 'ssp', 'age', 'category', '2014']","Public","Yes","published","English","NSW Department of Education","Dataset","[1443667335, 1443667335]","EDUCATION","Active","Annual","info@cese.nsw.gov.au","No","01.01.14","31.12.14","{'type': 'Polygon', 'coordinates': [[[140.999279036, -37.5050765707], [159.105430341, -37.5050765707], [159.105430341, -28.1570205549], [140.999279036, -28.1570205549], [140.999279036, -37.5050765707]]]}","9vz2-sixg","New South Wales","Students",,"n/a","1301 Education Systems"
"Permanent School Teacher Age Profiles, 2015","For more information, refer to attachment. Effective workforce planning processes enable the Department to meet the challenges of an ageing teaching workforce.","CC_30_BY_AUS","['age profiles', 'teachers', 'workforce planning', 'supply and demand', 'employment']","Public","Yes","published","English","NSW Department of Education","Dataset","[1453440377, 1453440377]","EDUCATION","Inactive","As required","info@cese.nsw.gov.au","No","01.01.15","31.12.15","{'type': 'Polygon', 'coordinates': [[[140.999279036, -37.5050765707], [159.105430341, -37.5050765707], [159.105430341, -28.1570205549], [140.999279036, -28.1570205549], [140.999279036, -37.5050765707]]]}","c7s6-d32d","New South Wales","Teachers",,"n/a","1301 Education Systems"
"Age-grade distribution of primary students in NSW government schools, 2014","Primary students by age and year of schooling (excluding support students), collected midyear 2014","CC_30_BY_AUS","['age', 'primary', 'year of schooling', 'age grade distribution']","Public","Yes","published","English","NSW Department of Education","Dataset","[1443664130, 1443664130]","EDUCATION","Active","Annual","info@cese.nsw.gov.au","No","01.01.14","31.12.14","{'type': 'Polygon', 'coordinates': [[[140.999279036, -37.5050765707], [159.105430341, -37.5050765707], [159.105430341, -28.1570205549], [140.999279036, -28.1570205549], [140.999279036, -37.5050765707]]]}","cum5-u9uj","New South Wales","Students",,"n/a","1301 Education Systems"
"Age-grade distribution of secondary students in NSW government schools, 2014","As at midyear 2014_x000D_
_x000D_
Full-time, secondary students by age and year of schooling (excluding support students)","CC_30_BY_AUS","['age', 'secondary', 'age grade distribution']","Public","Yes","published","English","NSW Department of Education","Dataset","[1443663987, 1443663987]","EDUCATION","Active","Annual","info@cese.nsw.gov.au","No","01.01.14","31.12.14","{'type': 'Polygon', 'coordinates': [[[140.999279036, -37.5050765707], [159.105430341, -37.5050765707], [159.105430341, -28.1570205549], [140.999279036, -28.1570205549], [140.999279036, -37.5050765707]]]}","w4zr-yr7h","New South Wales","Students",,"n/a","1301 Education Systems"
"Age-grade Distribution Of Students In Secondary Schools (part time), 2014","Age-grade Distribution Of Students In Secondary Schools (part time), mid-year 2014 (exc Support Students)","CC_30_BY_AUS","['age', 'students', 'age grade distribution', 'part time students', '2014']","Public","Yes","published","English","NSW Department of Education","Dataset","[1443666922, 1443666922]","EDUCATION","Active","Annual","info@cese.nsw.gov.au","No","01.01.14","31.12.14","{'type': 'Polygon', 'coordinates': [[[140.999279036, -37.5050765707], [159.105430341, -37.5050765707], [159.105430341, -28.1570205549], [140.999279036, -28.1570205549], [140.999279036, -37.5050765707]]]}","esi9-i8tn","New South Wales","Students",,"n/a","1301 Education Systems"
"NSW Public School Teachers - Age Distribution by Gender","Based on number of teachers employed on census date (2012) and includes casual teachers","CC_30_BY_AUS","['age', 'teachers']","Public","Yes","published","English","NSW Department of Education","Dataset","[1409812302, 1409815789]","EDUCATION","Inactive","As required","info@cese.nsw.gov.au","No","01.01.12","31.12.12","{'type': 'Polygon', 'coordinates': [[[140.999279036, -37.5050765707], [159.105430341, -37.5050765707], [159.105430341, -28.1570205549], [140.999279036, -28.1570205549], [140.999279036, -37.5050765707]]]}","fjry-zs82","New South Wales","Teachers",,"n/a","1301 Education Systems"
"Apprentices And Trainees in NSW, 2003-2011","Refer to attachment for more information. Apprenticeships are the principal way to enter into a trade occupation. The successful completion of apprenticeships is assisting to fill identified areas of skill shortages in New South Wales.","CC_30_BY_AUS","['apprentice', 'trainee', 'trade']","Public","Yes","published","English","NSW Department of Education","Dataset","[1453181730, 1453181730]","EDUCATION","Inactive","As required","info@cese.nsw.gov.au","No","01.01.03","31.12.11","{'type': 'Polygon', 'coordinates': [[[140.999279036, -37.5050765707], [159.105430341, -37.5050765707], [159.105430341, -28.1570205549], [140.999279036, -28.1570205549], [140.999279036, -37.5050765707]]]}","3nz7-m6ye","New South Wales","Vocational Education & Training (VET)",,"n/a","1301 Education Systems"
"Apprentices And Trainees Approvals in NSW, 2003-2011","Refer to attachment for more information. The number of apprentice approvals and new entrant trainees has grown by 18 per cent since 2003, an increase of 11,239 apprentices and trainees.","CC_30_BY_AUS","['apprentice', 'trainee', 'traineeship', 'apprenticeship']","Public","Yes","published","English","NSW Department of Education","Dataset","[1453181943, 1453181979]","EDUCATION","Inactive","As required","info@cese.nsw.gov.au","No","01.01.03","31.12.11","{'type': 'Polygon', 'coordinates': [[[140.999279036, -37.5050765707], [159.105430341, -37.5050765707], [159.105430341, -28.1570205549], [140.999279036, -28.1570205549], [140.999279036, -37.5050765707]]]}","938e-u7py","New South Wales","Vocational Education & Training (VET)",,"n/a","1301 Education Systems"
"School-based Apprenticeships And Traineeships In Public Schools, 2003-2011","For more information refer to attachment. School-based traineeships give students the opportunity to attain a nationally recognised vocational qualification as well as their Higher School Certificate (HSC). By taking up a school-based apprenticeship, students gain valuable work experience.","CC_30_BY_AUS","['apprentice', 'trainee', 'work experience', 'vet']","Public","Yes","published","English","NSW Department of Education","Dataset","[1454974744, 1454974744]","EDUCATION","Inactive","As required","info@cese.nsw.gov.au","No","01.01.03","31.12.11","{'type': 'Polygon', 'coordinates': [[[140.999279036, -37.5050765707], [159.105430341, -37.5050765707], [159.105430341, -28.1570205549], [140.999279036, -28.1570205549], [140.999279036, -37.5050765707]]]}","6sk6-w544","New South Wales","Higher Education",,"n/a","1301 Education Systems"
"Space Management Report, 2015","This Asset Management Space Report is the first in what will be an annual series of reports that sets out the extent and distribution of our school asset base; how well our buildings and grounds are utilised and changes to the asset base that have occurred over the last 10 years across the Principal Team Offices.","CC_30_BY_AUS","['assets', 'space management', 'school grounds']","Public","Yes","published","English","NSW Department of Education","Dataset","[1444786339, 1444866784]","EDUCATION","Inactive","As required","info@cese.nsw.gov.au","No","01.01.15","31.12.15","{'type': 'Polygon', 'coordinates': [[[140.999279036, -37.5050765707], [159.105430341, -37.5050765707], [159.105430341, -28.1570205549], [140.999279036, -28.1570205549], [140.999279036, -37.5050765707]]]}","tyx5-kgpy","New South Wales","Assets",,"n/a","1303 Education Systems"
"CESE Bulletin 15 - Government school Student Attendance, 2015","This bulletin presents analysis of attendance data at NSW government schools from 2006 to 2015. Results are presented for primary and secondary students. Attendance rates are also presented for aboriginal students, remoteness, and the Family Occupation and Employment Index (FOEI) of schools.","CC_30_BY_AUS","['attendance', 'aboriginal', 'indigenous', 'remote']","Public","Yes","published","English","NSW Department of Education","Dataset","[1456449378, 1456449485]","EDUCATION","Inactive","As required","info@cese.nsw.gov.au","No","01.01.15","31.12.15","{'type': 'Polygon', 'coordinates': [[[140.999279036, -37.5050765707], [159.105430341, -37.5050765707], [159.105430341, -28.1570205549], [140.999279036, -28.1570205549], [140.999279036, -37.5050765707]]]}","3buk-d7tf","New South Wales","Statistics Bulletins",,"n/a","1314 Education Systems"
"Student Attendance Rates by Aboriginality and Year Level, 2012 - Secondary","The attendance data are for full-time, Year 1-10 students only.","CC_30_BY_AUS","['attendance', 'aboriginal', 'indigenous', 'secondary']","Public","Yes","published","English","NSW Department of Education","Dataset","[1448319657, 1448319657]","EDUCATION","Active","Annual","info@cese.nsw.gov.au","No","01.01.12","31.12.12","{'type': 'Polygon', 'coordinates': [[[140.999279036, -37.5050765707], [159.105430341, -37.5050765707], [159.105430341, -28.1570205549], [140.999279036, -28.1570205549], [140.999279036, -37.5050765707]]]}","chmh-duzz","New South Wales","Attendance & Retention",,"n/a","1301 Education Systems"
"Student Attendance Rates by Aboriginality and Year Level, 2012 - Primary","The attendance data are for full-time, Year 1-10 students only._x000D_
_x000D_
All students in Years 1 to 10 in NSW Government Schools are regarded as full-time._x000D_
_x000D_
Ungraded students in NSW Government Schools are classified as either primary or secondary according to their level of education._x000D_
_x000D_
For more detailed analysis of Semester 1 school attendance, please refer to CESE Bulletin Issue 3 - Attendance Semester 1, 2012.","CC_30_BY_AUS","['attendance', 'aboriginal', 'year', '2012', 'primary', 'indigenous']","Public","Yes","published","English","NSW Department of Education","Dataset","[1448321447, 1448321447]","EDUCATION","Active","Annual","info@cese.nsw.gov.au","No","01.01.12","31.12.12","{'type': 'Polygon', 'coordinates': [[[140.999279036, -37.5050765707], [159.105430341, -37.5050765707], [159.105430341, -28.1570205549], [140.999279036, -28.1570205549], [140.999279036, -37.5050765707]]]}","kjsf-c866","New South Wales","Attendance & Retention",,"n/a","1301 Education Systems"
"Student Attendance Rates by Aboriginality and Year Level, 2012 - Primary","The attendance data are for full-time, Year 1-10 students only.

All students in Years 1 to 10 in NSW Government Schools are regarded as full-time.

Ungraded students in NSW Government Schools are classified as either primary or secondary according to their level of education.

For more detailed analysis of Semester 1 school attendance, please refer to CESE Bulletin Issue 3 - Attendance Semester 1, 2012.","CC_30_BY_AUS","['attendance', 'aboriginality', 'year', '2012', 'primary']","Public","Yes","published","English","NSW Department of Education","Dataset","[1448321447, 1438584650]","EDUCATION","Active","Annual","info@cese.nsw.gov.au","No","01.01.12","31.12.12","{'type': 'Polygon', 'coordinates': [[[140.999279036, -37.5050765707], [159.105430341, -37.5050765707], [159.105430341, -28.1570205549], [140.999279036, -28.1570205549], [140.999279036, -37.5050765707]]]}","3ni9-4zzc","New South Wales","Attendance & Retention",,"n/a","1301 Education Systems"
"Government School Student Attendance 2012 (Semester 1): CESE Bulletin 3","Research indicates a strong link between attendance and student achievement._x000D_
Recording and monitoring student attendance is an important requirement as part of_x000D_
the schools duty of care to all students in the school.","CC_30_BY_AUS","['attendance', 'bulletin', '2012', 'aboriginal', 'indigenous', 'student']","Public","Yes","published","English","NSW Department of Education","Dataset","[1397449611, 1448321769]","EDUCATION","Inactive","As required","info@cese.nsw.gov.au","No","01.01.12","31.12.12","{'type': 'Polygon', 'coordinates': [[[140.999279036, -37.5050765707], [159.105430341, -37.5050765707], [159.105430341, -28.1570205549], [140.999279036, -28.1570205549], [140.999279036, -37.5050765707]]]}","ays3-dgbm","New South Wales","Statistics Bulletins",,"n/a","1311 Education Systems"
"Government School Student Attendance 2013 (Semester 1) : CESE Bulletin 6","Government School Student Attendance 2013 (Semester 1)","CC_30_BY_AUS","['attendance', 'bulletin', '2013', 'government schools', 'aboriginal', 'indigenous']","Public","Yes","published","English","NSW Department of Education","Dataset","[1399937655, 1448321578]","EDUCATION","Inactive","As required","info@cese.nsw.gov.au","No","01.01.13","31.12.13","{'type': 'Polygon', 'coordinates': [[[140.999279036, -37.5050765707], [159.105430341, -37.5050765707], [159.105430341, -28.1570205549], [140.999279036, -28.1570205549], [140.999279036, -37.5050765707]]]}","qdad-684k","New South Wales","Statistics Bulletins",,"n/a","1304 Education Systems"
"Schools attendance rates by Aboriginality and year level, 2014","Schools attendance rates by Aboriginality and year level, 2014","CC_30_BY_AUS","['attendance', 'primary', 'secondary', 'indigenous']","Public","Yes","published","English","NSW Department of Education","Dataset","[1448319575, 1448319576]","EDUCATION","Active","Annual","info@cese.nsw.gov.au","No","01.01.14","31.12.14","{'type': 'Polygon', 'coordinates': [[[140.999279036, -37.5050765707], [159.105430341, -37.5050765707], [159.105430341, -28.1570205549], [140.999279036, -28.1570205549], [140.999279036, -37.5050765707]]]}","d7kt-a2h9","New South Wales","Attendance & Retention",,"n/a","1301 Education Systems"
"NSW Public Schools Income From Licensed Canteens, 2014","Refer to attachment for further information. In 2014, 386 schools chose to license their canteens with a total income of $5.64 million*.","CC_30_BY_AUS","['canteen', 'private', 'license', 'school income', 'school food']","Public","Yes","published","English","NSW Department of Education","Dataset","[1453434674, 1453434674]","EDUCATION","Active","Annual","info@cese.nsw.gov.au","No","01.01.14","31.12.14","{'type': 'Polygon', 'coordinates': [[[140.999279036, -37.5050765707], [159.105430341, -37.5050765707], [159.105430341, -28.1570205549], [140.999279036, -28.1570205549], [140.999279036, -37.5050765707]]]}","8tnz-viqy","New South Wales","Assets",,"n/a","1301 Education Systems"
"CESE Bulletin 13- Schools: InBrief Mid-Year Census 2014","InBrief summarises the results of the census of students in NSW government schools undertaken on Friday 1 August 2014, and the census of NSW non-government schools undertaken by the Australian Government Department of Education on the same day.","CC_30_BY_AUS","['census', 'government schools', 'non-government schools', '2014', 'preschool', 'primary', 'secondary', 'central/community', 'aboriginal', 'indigenous']","Public","Yes","published","English","NSW Department of Education","Dataset","[1440375656, 1448321863]","EDUCATION","Inactive","As required","info@cese.nsw.gov.au","No","01.01.14","31.12.14","{'type': 'Polygon', 'coordinates': [[[140.999279036, -37.5050765707], [159.105430341, -37.5050765707], [159.105430341, -28.1570205549], [140.999279036, -28.1570205549], [140.999279036, -37.5050765707]]]}","j9ti-zqt5","New South Wales","Statistics Bulletins",,"n/a","1310 Education Systems"
"Mid Year Census 2012: CESE Bulletin 4","This Bulletin summarises the results of the census of students in NSW government_x000D_
schools on Friday 3 August 2012, and the census of NSW non-government schools_x000D_
undertaken by the Department of Education, Employment and Workplace Relations.","CC_30_BY_AUS","['census', 'statistics', 'deewr', '2012', 'mid-year', 'bulletin', 'aboriginal', 'indigenous']","Public","Yes","published","English","NSW Department of Education","Dataset","[1397449954, 1448321710]","EDUCATION","Inactive","As required","info@cese.nsw.gov.au","No","01.01.12","31.12.12","{'type': 'Polygon', 'coordinates': [[[140.999279036, -37.5050765707], [159.105430341, -37.5050765707], [159.105430341, -28.1570205549], [140.999279036, -28.1570205549], [140.999279036, -37.5050765707]]]}","tsh6-bm4t","New South Wales","Statistics Bulletins",,"n/a","1308 Education Systems"
"Classes - Average Primary Class Sizes By Year, 1997 And 2002-2014","Average Primary Class Sizes By Year, 1997 And 2002-2014","CC_30_BY_AUS","['class size', 'primary']","Public","Yes","published","English","NSW Department of Education","Dataset","[1443404165, 1443404165]","EDUCATION","Active","Annual","info@cese.nsw.gov.au","No","01.01.97","31.12.14","{'type': 'Polygon', 'coordinates': [[[140.999279036, -37.5050765707], [159.105430341, -37.5050765707], [159.105430341, -28.1570205549], [140.999279036, -28.1570205549], [140.999279036, -37.5050765707]]]}","icsx-mgsg","New South Wales","Class Size",,"n/a","1301 Education Systems"
"NSW Government Schools By Classification 2001-2014","The classifications used in the table are not based on the 2014 actual enrolments collected through the mid-year census. The classifications are based on the staffing entitlement classifications reviewed periodically by the Classification Review Committee.","CC_30_BY_AUS","['classification', 'school type', 'enrolments']","Public","Yes","published","English","NSW Department of Education","Dataset","[1443599451, 1443599451]","EDUCATION","Active","Annual","info@cese.nsw.gov.au","No","01.01.01","31.12.14","{'type': 'Polygon', 'coordinates': [[[140.999279036, -37.5050765707], [159.105430341, -37.5050765707], [159.105430341, -28.1570205549], [140.999279036, -28.1570205549], [140.999279036, -37.5050765707]]]}","fd74-5hyk","New South Wales","Schools",,"n/a","1301 Education Systems"
"NSW Government Schools on the Country Area Program by Region and school type, midyear 2012","As at midyear 2012_x000D_
_x000D_
NSW Government Schools on the Country Area Program by Region and school type","CC_30_BY_AUS","['country area program', 'region']","Public","Yes","published","English","NSW Department of Education","Dataset","[1396576416, 1400762929]","EDUCATION","Inactive","As required","info@cese.nsw.gov.au","No","01.01.12","31.12.12","{'type': 'Polygon', 'coordinates': [[[140.999279036, -37.5050765707], [159.105430341, -37.5050765707], [159.105430341, -28.1570205549], [140.999279036, -28.1570205549], [140.999279036, -37.5050765707]]]}","qm24-x3n3","New South Wales","Schools",,"n/a","1301 Education Systems"
"Course Enrolments In Year 10 Subjects In NSW Government Schools, 2012","Hours equal to the number of hours studied over Years 9 and 10.","CC_30_BY_AUS","['course', 'enrolments', 'year 10', 'nsw', 'government schools', '2012']","Public","Yes","published","English","NSW Department of Education","Dataset","[1443669706, 1438584743]","EDUCATION","Active","Annual","info@cese.nsw.gov.au","No","01.01.12","31.12.12","{'type': 'Polygon', 'coordinates': [[[140.999279036, -37.5050765707], [159.105430341, -37.5050765707], [159.105430341, -28.1570205549], [140.999279036, -28.1570205549], [140.999279036, -37.5050765707]]]}","xarx-xrah","New South Wales","Subject & Course Enrolment",,"n/a","1301 Education Systems"
"Course Enrolments In Year 10 Subjects In NSW Government Schools, 2014","Hours equal to the number of hours studied over Years 9 and 10.","CC_30_BY_AUS","['course', 'enrolments', 'year 10', 'nsw', 'government schools', '2014', 'aboriginal', 'indigenous']","Public","Yes","published","English","NSW Department of Education","Dataset","[1443669706, 1448321635]","EDUCATION","Active","Annual","info@cese.nsw.gov.au","No","01.01.14","31.12.14","{'type': 'Polygon', 'coordinates': [[[140.999279036, -37.5050765707], [159.105430341, -37.5050765707], [159.105430341, -28.1570205549], [140.999279036, -28.1570205549], [140.999279036, -37.5050765707]]]}","u6w3-xvwr","New South Wales","Subject & Course Enrolment",,"n/a","1301 Education Systems"
"Course Enrolments in Year 11 and Year 12 Subjects in NSW Government Schools, 2012 - Apprenticeships","Based on school of tuition, board developed courses only, and includes subjects studied through distance education, the Open High School and Saturday School of Community Languages.","CC_30_BY_AUS","['course', 'enrolments', 'year 11', 'year 12', 'nsw', 'government schools', '2012', 'apprenticeships']","Public","Yes","published","English","NSW Department of Education","Dataset","[1396580875, 1429129022]","EDUCATION","Active","Annual","info@cese.nsw.gov.au","No","01.01.12","31.12.12","{'type': 'Polygon', 'coordinates': [[[140.999279036, -37.5050765707], [159.105430341, -37.5050765707], [159.105430341, -28.1570205549], [140.999279036, -28.1570205549], [140.999279036, -37.5050765707]]]}","fakc-9sbi","New South Wales","Subject & Course Enrolment",,"n/a","1301 Education Systems"
"Course Enrolments in Year 11 And Year 12 Subjects in NSW Government Schools, 2012","Based on school of tuition, board developed courses only, and includes subjects studied through distance education, the Open High School and Saturday School of Community Languages.","CC_30_BY_AUS","['course', 'enrolments', 'year 11', 'year 12', 'subjects', 'nsw', 'government schools', '2012']","Public","Yes","published","English","NSW Department of Education","Dataset","[1443669927, 1438584658]","EDUCATION","Active","Annual","info@cese.nsw.gov.au","No","01.01.12","31.12.12","{'type': 'Polygon', 'coordinates': [[[140.999279036, -37.5050765707], [159.105430341, -37.5050765707], [159.105430341, -28.1570205549], [140.999279036, -28.1570205549], [140.999279036, -37.5050765707]]]}","gi2v-iqkt","New South Wales","Subject & Course Enrolment",,"n/a","1301 Education Systems"
"Course Enrolments in Year 11 And Year 12 Subjects in NSW Government Schools, 2014","Based on school of tuition, board developed courses only, and includes subjects studied through distance education, the Open High School and Saturday School of Community Languages.","CC_30_BY_AUS","['course', 'enrolments', 'year 11', 'year 12', 'subjects', 'nsw', 'government schools', '2014', 'aboriginal', 'indigenous']","Public","Yes","published","English","NSW Department of Education","Dataset","[1443669927, 1448321531]","EDUCATION","Active","As required","info@cese.nsw.gov.au","No","01.01.14","31.12.14","{'type': 'Polygon', 'coordinates': [[[140.999279036, -37.5050765707], [159.105430341, -37.5050765707], [159.105430341, -28.1570205549], [140.999279036, -28.1570205549], [140.999279036, -37.5050765707]]]}","am7s-q7d7","New South Wales","Subject & Course Enrolment",,"n/a","1301 Education Systems"
