"Support Classes And Services, 2013","In 2013 more than 90,000 students with a disability and/or additional learning and support needs are enrolled in NSW public schools. Students with confirmed disability can enrol in regular classes with support, and in support classes in regular_x000D_
and special schools. There are 1,911 learning and support teachers in public schools in NSW.","CC_30_BY_AUS","['disability', 'support', 'additional services']","Public","Yes","published","English","NSW Department of Education","Dataset","[1454975608, 1454975609]","EDUCATION","Inactive","As required","info@cese.nsw.gov.au","No","01.01.13","31.12.13","{'type': 'Polygon', 'coordinates': [[[140.999279036, -37.5050765707], [159.105430341, -37.5050765707], [159.105430341, -28.1570205549], [140.999279036, -28.1570205549], [140.999279036, -37.5050765707]]]}","vhvk-wer5","New South Wales","Schools",,"n/a","1301 Education Systems"
"Enrolments (FTE) In Distance Education By Year Of Schooling, 2014","Enrolments (FTE) in distance education by year of schooling, mid-year 2014","CC_30_BY_AUS","['enrolment', 'distance education', 'students', '2014']","Public","Yes","published","English","NSW Department of Education","Dataset","[1443667581, 1443667581]","EDUCATION","Active","Annual","info@cese.nsw.gov.au","No","01.01.14","31.12.14","{'type': 'Polygon', 'coordinates': [[[140.999279036, -37.5050765707], [159.105430341, -37.5050765707], [159.105430341, -28.1570205549], [140.999279036, -28.1570205549], [140.999279036, -37.5050765707]]]}","9bt9-haua","New South Wales","Students",,"n/a","1301 Education Systems"
"Enrolments (FTE) In NSW Government Schools By FOEI Quarters And SA4 Groupings, 2014","Enrolments (FTE) in NSW government schools by FOEI quarters and SA4 groupings, April 2014","CC_30_BY_AUS","['enrolment', 'fte', 'foei', 'sa4', '2014']","Public","Yes","published","English","NSW Department of Education","Dataset","[1443668535, 1443668535]","EDUCATION","Active","Annual","info@cese.nsw.gov.au","No","01.01.14","31.12.14","{'type': 'Polygon', 'coordinates': [[[140.999279036, -37.5050765707], [159.105430341, -37.5050765707], [159.105430341, -28.1570205549], [140.999279036, -28.1570205549], [140.999279036, -37.5050765707]]]}","px27-kj8q","New South Wales","Students",,"n/a","1301 Education Systems"
"Enrolment Of Students Of LBOTE In NSW Government Schools, 2014 ( SA4 And Grade)","Enrolment of students of language background other than English (LBOTE) in NSW government schools, March 2014 by SA4 groupings and grade groups","CC_30_BY_AUS","['enrolment', 'students', 'lbote', 'sa4', 'grade']","Public","Yes","published","English","NSW Department of Education","Dataset","[1443668419, 1443668419]","EDUCATION","Active","Annual","info@cese.nsw.gov.au","No","01.01.14","31.12.14","{'type': 'Polygon', 'coordinates': [[[140.999279036, -37.5050765707], [159.105430341, -37.5050765707], [159.105430341, -28.1570205549], [140.999279036, -28.1570205549], [140.999279036, -37.5050765707]]]}","3i53-x77y","New South Wales","Students",,"n/a","1301 Education Systems"
"Enrolments (FTE) In NSW Government Schools - 1970, 1980, 1990, 1993-2014","Enrolments (FTE) In NSW Government Schools - 1970, 1980, 1990, 1993-2014._x000D_
_x000D_
Since 1993 some students have enrolled part-time and all enrolments are reported in full-time equivalent units (FTEs) and include full-time and part-time students.","CC_30_BY_AUS","['enrolments', 'fte']","Public","Yes","published","English","NSW Department of Education","Dataset","[1459753145, 1459753145]","EDUCATION","Active","Annual","info@cese.nsw.gov.au","No","01.01.14","31.12.14","{'type': 'Polygon', 'coordinates': [[[140.999279036, -37.5050765707], [159.105430341, -37.5050765707], [159.105430341, -28.1570205549], [140.999279036, -28.1570205549], [140.999279036, -37.5050765707]]]}","qsmd-gpg3","New South Wales","Students",,"n/a","1301 Education Systems"
"Enrolments (head count) School Level 2004 to 2013","National Schools Statistics Collection (NSSC) enrolments collected as at the first Friday in August every year._x000D_
All NSSC enrolments are headcount figures._x000D_
Where a school had 5 or fewer students, the figure has been suppressed._x000D_
A blank figure indicates no enrolments were collected for NSSC in the given calendar year.","CC_30_BY_AUS","['enrolments', 'head count']","Public","Yes","published","English","NSW Department of Education","Dataset","[1413325888, 1413326031]","EDUCATION","Active","Annual","info@cese.nsw.gov.au","No","01.01.04","31.13.13","{'type': 'Polygon', 'coordinates': [[[140.999279036, -37.5050765707], [159.105430341, -37.5050765707], [159.105430341, -28.1570205549], [140.999279036, -28.1570205549], [140.999279036, -37.5050765707]]]}","wqm6-3zjf","New South Wales","Schools",,"n/a","1301 Education Systems"
"NSW Government School Enrolments By Scholastic Year 2014","Source: Statistics Unit, Centre for Education Statistics and Evaluation, DEC. Extracted in June 2015. Mid-Year Census 2014.								
								
Notes:								
1) Enrolments are full-time equivalent (FTE) enrolments. For the purposes of State reporting, only students in Year 11 and 12 may be part-time. Hence there is no difference between ""full-time"" and ""full-time equivalent"" enrolments for K-10 or ungraded in NSW government schools.								
2) Ungraded students are students who are not assigned to a particular grade.  They are often enrolled in support classes or schools for specific purposes (SSPs)								
3) Total enrolments are provided for Schools for Specific Purposes.  All these students are classified as ungraded students.								
4) sp: data suppressed where enrolments are 5 or fewer. Where only one grade at a school had a value of <=5, the ungraded cell has also been suppressed for privacy reasons. Where there are no ungraded students, the grade with the next lowest total has also suppressed.","CC_30_BY_AUS","['enrolments', 'scholastic year']","Public","Yes","published","English","NSW Department of Education","Dataset","[1442982325, 1442982326]","EDUCATION","Active","Annual","info@cese.nsw.gov.au","No","01.01.14","31.12.14","{'type': 'Polygon', 'coordinates': [[[140.999279036, -37.5050765707], [159.105430341, -37.5050765707], [159.105430341, -28.1570205549], [140.999279036, -28.1570205549], [140.999279036, -37.5050765707]]]}","yfwy-xj5h","New South Wales","Schools",,"n/a","1301 Education Systems"
"Out-of-pocket expenses (after subsidies) for families with children in full-time centre-based long day care, as a proportion of gross annual disposable income, NSW and Australia, March quarter 2013","Source: SCRGSP 2014, Report on Government Services 2014, vol. B Childcare, education and training, Productivity Commission, Canberra, Table 3A.57","CC_30_BY_AUS","['expenses', 'out-of-pocket', 'long day care']","Public","Yes","published","English","NSW Department of Education","Dataset","[1409844155, 1409844155]","EDUCATION","Inactive","As required","info@cese.nsw.gov.au","No","01.01.13","31.12.13","{'type': 'Polygon', 'coordinates': [[[140.999279036, -37.5050765707], [159.105430341, -37.5050765707], [159.105430341, -28.1570205549], [140.999279036, -28.1570205549], [140.999279036, -37.5050765707]]]}","adtp-4f3f","New South Wales","Early childhood",,"n/a","1301 Education Systems"
"Gender Analysis Of School Teachers, 2015","Refer to attachment for more information.The Department adheres to the principles of Equal Employment Opportunity in all aspects of teacher recruitment and promotion. Male and female teachers are employed in NSW public schools across all stages of learning.","CC_30_BY_AUS","['gender', 'male', 'female', 'equality']","Public","Yes","published","English","NSW Department of Education","Dataset","[1453427495, 1453427495]","EDUCATION","Inactive","As required","info@cese.nsw.gov.au","No","01.01.15","31.12.15","{'type': 'Polygon', 'coordinates': [[[140.999279036, -37.5050765707], [159.105430341, -37.5050765707], [159.105430341, -28.1570205549], [140.999279036, -28.1570205549], [140.999279036, -37.5050765707]]]}","6tkh-kd26","New South Wales","Teachers",,"n/a","1301 Education Systems"
"HSC Completions NSW Public Schools Students, 2008-2013","For more information refer to attachment. The number of students at government schools awarded the HSC continues to rise.","CC_30_BY_AUS","['hsc', 'aboriginal', 'indigenous', 'high achievers']","Public","Yes","published","English","NSW Department of Education","Dataset","[1453429969, 1453429969]","EDUCATION","Active","Annual","info@cese.nsw.gov.au","No","01.01.08","31.12.13","{'type': 'Polygon', 'coordinates': [[[140.999279036, -37.5050765707], [159.105430341, -37.5050765707], [159.105430341, -28.1570205549], [140.999279036, -28.1570205549], [140.999279036, -37.5050765707]]]}","f68r-jzcp","New South Wales","Students",,"n/a","1301 Education Systems"
"NSW Government School HSC Completions, Year 12, 2004-2014","NSW government school HSC completions, Year 12 students only, 2004-2014","CC_30_BY_AUS","['hsc', 'completions', 'students', '2004-2014', 'aboriginal', 'indigenous']","Public","Yes","published","English","NSW Department of Education","Dataset","[1443670074, 1448321878]","EDUCATION","Active","Annual","info@cese.nsw.gov.au","No","01.01.04","311.12.14","{'type': 'Polygon', 'coordinates': [[[140.999279036, -37.5050765707], [159.105430341, -37.5050765707], [159.105430341, -28.1570205549], [140.999279036, -28.1570205549], [140.999279036, -37.5050765707]]]}","yvh7-2y7f","New South Wales","Students",,"n/a","1301 Education Systems"
"HSC High Achievers In NSW Public Schools, 2008-2013","Refer to attachment for more information. The number of students from NSW public schools who were placed on the Distinguished Achievers List (achieving a highest band result of over 90 for a course) increased from 7,471 in 2012 to 7,519 in 2013.","CC_30_BY_AUS","['hsc', 'high achievers', 'indigenous', 'aboriginal']","Public","Yes","published","English","NSW Department of Education","Dataset","[1453430197, 1453430197]","EDUCATION","Active","Annual","info@cese.nsw.gov.au","No","01.01.08","31.12.13","{'type': 'Polygon', 'coordinates': [[[140.999279036, -37.5050765707], [159.105430341, -37.5050765707], [159.105430341, -28.1570205549], [140.999279036, -28.1570205549], [140.999279036, -37.5050765707]]]}","ntuz-7qdq","New South Wales","Students",,"n/a","1301 Education Systems"
"Year 12 Estimated Completion Rates, 2009-2013","For more information refer to attachment. Year 12 completion rates are one measure of students successful completion of their schooling. These completion rates relate to the number of students who meet the Higher School Certificate requirements as a proportion of the estimated population of young people that could attend Year 12 in a calendar year.","CC_30_BY_AUS","['hsc', 'year 12', 'completions rates', 'attendance', 'students']","Public","Yes","published","English","NSW Department of Education","Dataset","[1454979015, 1454979015]","EDUCATION","Inactive","As required","info@cese.nsw.gov.au","No","01.01.09","31.12.13","{'type': 'Polygon', 'coordinates': [[[140.999279036, -37.5050765707], [159.105430341, -37.5050765707], [159.105430341, -28.1570205549], [140.999279036, -28.1570205549], [140.999279036, -37.5050765707]]]}","imuz-npxm","New South Wales","Higher Education",,"n/a","1301 Education Systems"
"Language diversity in NSW government schools in 2013: CESE Bulletin 5","This bulletin summarises the diversity of students with a language background other than English (LBOTE) who are enrolled in NSW government schools in 2013.","CC_30_BY_AUS","['language', 'lbote', '2013', 'diversity', 'bulletin', 'aboriginal', 'indigenous']","Public","Yes","published","English","NSW Department of Education","Dataset","[1397449332, 1448321656]","EDUCATION","Inactive","As required","info@cese.nsw.gov.au","No","01.01.13","31.12.13","{'type': 'Polygon', 'coordinates': [[[140.999279036, -37.5050765707], [159.105430341, -37.5050765707], [159.105430341, -28.1570205549], [140.999279036, -28.1570205549], [140.999279036, -37.5050765707]]]}","dd9p-ttj5","New South Wales","Statistics Bulletins",,"n/a","1306 Education Systems"
"Language Participation Year 7-9 by Gender and School Year","As of August 2012_x000D_
_x000D_
The table includes only students learning a language on average for more than 1 hour per week for 35 or more weeks a year._x000D_
_x000D_
There were an additional 23,449 students who were learning a language for a shorter duration.","CC_30_BY_AUS","['language', 'rear 7', 'year 8', 'year 9', 'gender', 'year', '2012']","Public","Yes","published","English","NSW Department of Education","Dataset","[1462842451, 1438584754]","EDUCATION","Inactive","As required","info@cese.nsw.gov.au","No","01.01.14","31.12.14","{'type': 'Polygon', 'coordinates': [[[140.999279036, -37.5050765707], [159.105430341, -37.5050765707], [159.105430341, -28.1570205549], [140.999279036, -28.1570205549], [140.999279036, -37.5050765707]]]}","c6vd-e5mq","New South Wales","Subject & Course Enrolment",,"n/a","1301 Education Systems"
"Language Participation Year 7-9 By Gender And School Year, 2014 (NSW Government Schools)","As at August 2014_x000D_
_x000D_
The table includes only students learning a language on average for more than 1 hour per week for 35 or more weeks a year._x000D_
_x000D_
There were an additional 23,449 students who were learning a language for a shorter duration.","CC_30_BY_AUS","['language', 'year 7', 'year 8', 'year 9', 'gender', 'year', '2014', 'language participation']","Public","Yes","published","English","NSW Department of Education","Dataset","[1462842451, 1462842451]","EDUCATION","Inactive","As required","info@cese.nsw.gov.au","No","01.01.14","31.12.14","{'type': 'Polygon', 'coordinates': [[[140.999279036, -37.5050765707], [159.105430341, -37.5050765707], [159.105430341, -28.1570205549], [140.999279036, -28.1570205549], [140.999279036, -37.5050765707]]]}","p628-ua5u","New South Wales","Subject & Course Enrolment",,"n/a","1301 Education Systems"
"NSW Government Schools By MCEECDYA Remoteness And SA4 Groupings, 2014","MCEECDYA Remoteness Indicator divides schools into four categories- metropolitan, provincial, remote and very remote. This table shows government schools by remoteness and SA4 groupings.","CC_30_BY_AUS","['mceecdya', 'remoteness', 'sa4', 'metropolitan', 'provincial', 'remote', 'very remote']","Public","Yes","published","English","NSW Department of Education","Dataset","[1443658550, 1443658550]","EDUCATION","Active","Annual","info@cese.nsw.gov.au","No","01.01.14","31.12.14","{'type': 'Polygon', 'coordinates': [[[140.999279036, -37.5050765707], [159.105430341, -37.5050765707], [159.105430341, -28.1570205549], [140.999279036, -28.1570205549], [140.999279036, -37.5050765707]]]}","bkk2-n68d","New South Wales","Schools",,"n/a","1301 Education Systems"
"School Teacher Medical Retirements By Year, 2000-2015","In a workforce of around 49,000 permanent school teachers, the NSW Department of Education has a very low rate of medical retirements. Medical retirements arise from a range for serious medical conditions.","CC_30_BY_AUS","['medical conditions', 'retirements', 'permanent staff', 'teachers']","Public","Yes","published","English","NSW Department of Education","Dataset","[1454974448, 1454974448]","EDUCATION","Inactive","As required","info@cese.nsw.gov.au","No","01.01.00","31.12.15","{'type': 'Polygon', 'coordinates': [[[140.999279036, -37.5050765707], [159.105430341, -37.5050765707], [159.105430341, -28.1570205549], [140.999279036, -28.1570205549], [140.999279036, -37.5050765707]]]}","9fui-ybgk","New South Wales","Teachers",,"n/a","1301 Education Systems"
"Proportion of students at or above the National Minimum Standard for NAPLAN Reading and Numeracy, Year 3, NSW, 2008-13","Source: Australian Curriculum, Assessment and Reporting Authority 2013, NAPLAN Achievement in Reading, Persuasive Writing, Language Conventions and Numeracy: National Report for 2013, ACARA, Sydney","CC_30_BY_AUS","['naplan', 'year 3']","Public","Yes","published","English","NSW Department of Education","Dataset","[1409842189, 1429128478]","EDUCATION","Inactive","Annual","info@cese.nsw.gov.au","No","01.01.08","31.12.13","{'type': 'Polygon', 'coordinates': [[[140.999279036, -37.5050765707], [159.105430341, -37.5050765707], [159.105430341, -28.1570205549], [140.999279036, -28.1570205549], [140.999279036, -37.5050765707]]]}","i8tz-u84r","New South Wales","NAPLAN Summaries",,"n/a","1301 Education Systems"
"Proportion of students at or above the National Minimum Standard for NAPLAN Reading and Numeracy, Year 5, NSW, 2008-13","Source: Australian Curriculum, Assessment and Reporting Authority 2013, NAPLAN Achievement in Reading, Persuasive Writing, Language Conventions and Numeracy: National Report for 2013, ACARA, Sydney","CC_30_BY_AUS","['naplan', 'year 5']","Public","Yes","published","English","NSW Department of Education","Dataset","[1409842462, 1429128478]","EDUCATION","Inactive","As required","info@cese.nsw.gov.au","No","01.01.08","31.12.13","{'type': 'Polygon', 'coordinates': [[[140.999279036, -37.5050765707], [159.105430341, -37.5050765707], [159.105430341, -28.1570205549], [140.999279036, -28.1570205549], [140.999279036, -37.5050765707]]]}","9x65-2bt5","New South Wales","NAPLAN Summaries",,"n/a","1301 Education Systems"
"Proportion of students at or above the National Minimum Standard for NAPLAN Reading and Numeracy, Year 7, NSW, 2008-13","Source: Australian Curriculum, Assessment and Reporting Authority 2013, NAPLAN Achievement in Reading, Persuasive Writing, Language Conventions and Numeracy: National Report for 2013, ACARA, Sydney","CC_30_BY_AUS","['naplan', 'year 7']","Public","Yes","published","English","NSW Department of Education","Dataset","[1409842659, 1429128478]","EDUCATION","Inactive","As required","info@cese.nsw.gov.au","No","01.01.08","31.12.13","{'type': 'Polygon', 'coordinates': [[[140.999279036, -37.5050765707], [159.105430341, -37.5050765707], [159.105430341, -28.1570205549], [140.999279036, -28.1570205549], [140.999279036, -37.5050765707]]]}","q4ye-7xv8","New South Wales","NAPLAN Summaries",,"n/a","1301 Education Systems"
"Proportion of students at or above the National Minimum Standard for NAPLAN Reading and Numeracy, Year 9, NSW, 2008-13","Source; Australian Curriculum, Assessment and Reporting Authority 2013, NAPLAN Achievement in Reading, Persuasive Writing, Language Conventions and Numeracy: National Report for 2013, ACARA, Sydney","CC_30_BY_AUS","['naplan', 'year 9']","Public","Yes","published","English","NSW Department of Education","Dataset","[1409842850, 1429128478]","EDUCATION","Active","Annual","info@cese.nsw.gov.au","No","01.01.08","31.12.13","{'type': 'Polygon', 'coordinates': [[[140.999279036, -37.5050765707], [159.105430341, -37.5050765707], [159.105430341, -28.1570205549], [140.999279036, -28.1570205549], [140.999279036, -37.5050765707]]]}","ctz6-6ki4","New South Wales","NAPLAN Summaries",,"n/a","1301 Education Systems"
"Opportunity Class Students With Language Background  Other Than English (LBOTE), 2008-2013","Refer to attachment for further information. Opportunity classes provide intellectual stimulation and an educationally enriched environment for academically gifted and talented children in Years 5 and 6. Students are identified as having a language background other than English (LBOTE) if they indicate that English is not the main language spoken in the home.","CC_30_BY_AUS","['opportunity class', 'oc', 'gifted and talented', 'lbote', 'language background']","Public","Yes","published","English","NSW Department of Education","Dataset","[1453439953, 1453439953]","EDUCATION","Inactive","As required","info@cese.nsw.gov.au","No","01.01.08","31.12.13","{'type': 'Polygon', 'coordinates': [[[140.999279036, -37.5050765707], [159.105430341, -37.5050765707], [159.105430341, -28.1570205549], [140.999279036, -28.1570205549], [140.999279036, -37.5050765707]]]}","9eg5-nxer","New South Wales","Students",,"n/a","1301 Education Systems"
"Average weekly hours of attendance of children in the year before full-time school in NSW Government-operated and NSW Government-funded preschools, 2011-13","These results do not include long day care enrolment data because the Commonwealth Child Care Management System (CCMS) data does not provide hourly enrolment or attendance information.									

Due to improved data collection, major modifications to calculation methods were agreed from 2011 resulting in breaks in the series for this performance indicator. These changes included the exclusion of (previously included) 3 year old children enrolled at government and community preschools and better estimates of preschool participation in long day care.									
									
Source: NSW Department of Education, 2012 Annual report on achieving universal access to early childhood education in NSW (forthcoming) and internal data","CC_30_BY_AUS","['preschool', 'attendance', 'hours']","Public","Yes","published","English","NSW Department of Education","Dataset","[1409843381, 1409843381]","EDUCATION","Inactive","As required","info@cese.nsw.gov.au","No","01.01.11","31.12.13","{'type': 'Polygon', 'coordinates': [[[140.999279036, -37.5050765707], [159.105430341, -37.5050765707], [159.105430341, -28.1570205549], [140.999279036, -28.1570205549], [140.999279036, -37.5050765707]]]}","33x8-e3wq","New South Wales","Early childhood",,"n/a","1301 Education Systems"
"Comparison of average daily fees in Government-funded preschools for all children and children in equity groups (2013 dollars), 2008-13","2013 - Fee relief initiative_x000D_
Sources: _x000D_
NSW Department of Education, 2012 Annual report on achieving universal access to early childhood education in NSW (forthcoming) and internal data _x000D_
Australian Bureau of Statistics, 6401.0 - Consumer Price Index, Australia","CC_30_BY_AUS","['preschool', 'fees', 'aboriginal', 'indigenous']","Public","Yes","published","English","NSW Department of Education","Dataset","[1409843661, 1448321693]","EDUCATION","Inactive","As required","info@cese.nsw.gov.au","No","01.01.08","31.12.13","{'type': 'Polygon', 'coordinates': [[[140.999279036, -37.5050765707], [159.105430341, -37.5050765707], [159.105430341, -28.1570205549], [140.999279036, -28.1570205549], [140.999279036, -37.5050765707]]]}","ntur-43m5","New South Wales","Early childhood",,"n/a","1301 Education Systems"
"Proportion of children accessing a preschool program in their year prior to school, 2011-13","Due to improved data collection, major modifications to calculation methods were agreed from 2011 resulting in breaks in the series for this performance indicator. These changes included the exclusion of (previously included) 3 year old children enrolled at government and community preschools and better estimates of preschool participation in long day care.											
										
Source: NSW Department of Education, NSW 2013 Supplementary Data Report under the National Partnership Agreement on Universal Access to Early Childhood Education (forthcoming).","CC_30_BY_AUS","['preschool']","Public","Yes","published","English","NSW Department of Education","Dataset","[1409843089, 1409843089]","EDUCATION","Inactive","As required","info@cese.nsw.gov.au","No","01.01.11","31.12.13","{'type': 'Polygon', 'coordinates': [[[140.999279036, -37.5050765707], [159.105430341, -37.5050765707], [159.105430341, -28.1570205549], [140.999279036, -28.1570205549], [140.999279036, -37.5050765707]]]}","nfe4-bedv","New South Wales","Early childhood",,"n/a","1301 Education Systems"
"Primary Students in NSW Government Schools Studying a Language Other than English by Year of Schooling and Language, 2014","As at May, 2014_x000D_
_x000D_
Students may study more than one language. Students in Distance Education and Opportunity Classes (OC) are included with their appropriate grade levels.","CC_30_BY_AUS","['primary', 'students', 'languages', '2014']","Public","Yes","published","English","NSW Department of Education","Dataset","[1443668743, 1443668743]","EDUCATION","Active","Annual","info@cese.nsw.gov.au","No","01.01.14","31.12.14","{'type': 'Polygon', 'coordinates': [[[140.999279036, -37.5050765707], [159.105430341, -37.5050765707], [159.105430341, -28.1570205549], [140.999279036, -28.1570205549], [140.999279036, -37.5050765707]]]}","r2dx-8692","New South Wales","Subject & Course Enrolment",,"n/a","1301 Education Systems"
"NSW Government Schools on Priority Schools Funding Program by region and school type","As at midyear 2012_x000D_
_x000D_
NSW Goverment Schools on Priority Schools Funding Program by region and school type","CC_30_BY_AUS","['priority schools funding program', 'region']","Public","Yes","published","English","NSW Department of Education","Dataset","[1396576239, 1400762851]","EDUCATION","Active","As required","info@cese.nsw.gov.au","No","01.01.12","31.12.12","{'type': 'Polygon', 'coordinates': [[[140.999279036, -37.5050765707], [159.105430341, -37.5050765707], [159.105430341, -28.1570205549], [140.999279036, -28.1570205549], [140.999279036, -37.5050765707]]]}","3kds-gvzu","New South Wales","Schools",,"n/a","1301 Education Systems"
"CESE Bulletin 8- Schools: Language Diversity in NSW, 2014","This bulletin summarises the diversity of students with a language background other than English (LBOTE) who are enrolled in NSW government schools in 2014.","CC_30_BY_AUS","['public schools', 'primary', 'secondary', 'lbote', 'language diversity', '2014', 'aboriginal', 'indigenous']","Public","Yes","published","English","NSW Department of Education","Dataset","[1440375281, 1448321897]","EDUCATION","Inactive","As required","info@cese.nsw.gov.au","No","01.01.14","31.12.14","{'type': 'Polygon', 'coordinates': [[[140.999279036, -37.5050765707], [159.105430341, -37.5050765707], [159.105430341, -28.1570205549], [140.999279036, -28.1570205549], [140.999279036, -37.5050765707]]]}","qyim-patw","New South Wales","Statistics Bulletins",,"n/a","1312 Education Systems"
